{"formatVersion":1,"profile":"unicode16-search-scripts-v1","unicodeVersion":"16.0.0","defaultScript":"Zzzz","extensionsDefault":"primary-script","sourceSha256":{"Scripts.txt":"9e88f0a677df47311106340be8ede2ecdacd9c1c931831218d2be6d5508e0039","ScriptExtensions.txt":"049117ce26b9769fe2749b06eef51a50a89faef4a97764dd2d81daa715980700","PropertyValueAliases.txt":"440fd3e5460b9bfe31da67b6f923992e1989d31fe2ed91e091c4b8f8e2620bf9"},"licenseSha256":"e7a93b009565cfce55919a381437ac4db883e9da2126fa28b91d12732bc53d96","scriptValues":[["Adlm","Adlam"],["Aghb","Caucasian_Albanian"],["Ahom","Ahom"],["Arab","Arabic"],["Armi","Imperial_Aramaic"],["Armn","Armenian"],["Avst","Avestan"],["Bali","Balinese"],["Bamu","Bamum"],["Bass","Bassa_Vah"],["Batk","Batak"],["Beng","Bengali"],["Bhks","Bhaiksuki"],["Bopo","Bopomofo"],["Brah","Brahmi"],["Brai","Braille"],["Bugi","Buginese"],["Buhd","Buhid"],["Cakm","Chakma"],["Cans","Canadian_Aboriginal"],["Cari","Carian"],["Cham","Cham"],["Cher","Cherokee"],["Chrs","Chorasmian"],["Copt","Coptic"],["Cpmn","Cypro_Minoan"],["Cprt","Cypriot"],["Cyrl","Cyrillic"],["Deva","Devanagari"],["Diak","Dives_Akuru"],["Dogr","Dogra"],["Dsrt","Deseret"],["Dupl","Duployan"],["Egyp","Egyptian_Hieroglyphs"],["Elba","Elbasan"],["Elym","Elymaic"],["Ethi","Ethiopic"],["Gara","Garay"],["Geor","Georgian"],["Glag","Glagolitic"],["Gong","Gunjala_Gondi"],["Gonm","Masaram_Gondi"],["Goth","Gothic"],["Gran","Grantha"],["Grek","Greek"],["Gujr","Gujarati"],["Gukh","Gurung_Khema"],["Guru","Gurmukhi"],["Hang","Hangul"],["Hani","Han"],["Hano","Hanunoo"],["Hatr","Hatran"],["Hebr","Hebrew"],["Hira","Hiragana"],["Hluw","Anatolian_Hieroglyphs"],["Hmng","Pahawh_Hmong"],["Hmnp","Nyiakeng_Puachue_Hmong"],["Hrkt","Katakana_Or_Hiragana"],["Hung","Old_Hungarian"],["Ital","Old_Italic"],["Java","Javanese"],["Kali","Kayah_Li"],["Kana","Katakana"],["Kawi","Kawi"],["Khar","Kharoshthi"],["Khmr","Khmer"],["Khoj","Khojki"],["Kits","Khitan_Small_Script"],["Knda","Kannada"],["Krai","Kirat_Rai"],["Kthi","Kaithi"],["Lana","Tai_Tham"],["Laoo","Lao"],["Latn","Latin"],["Lepc","Lepcha"],["Limb","Limbu"],["Lina","Linear_A"],["Linb","Linear_B"],["Lisu","Lisu"],["Lyci","Lycian"],["Lydi","Lydian"],["Mahj","Mahajani"],["Maka","Makasar"],["Mand","Mandaic"],["Mani","Manichaean"],["Marc","Marchen"],["Medf","Medefaidrin"],["Mend","Mende_Kikakui"],["Merc","Meroitic_Cursive"],["Mero","Meroitic_Hieroglyphs"],["Mlym","Malayalam"],["Modi","Modi"],["Mong","Mongolian"],["Mroo","Mro"],["Mtei","Meetei_Mayek"],["Mult","Multani"],["Mymr","Myanmar"],["Nagm","Nag_Mundari"],["Nand","Nandinagari"],["Narb","Old_North_Arabian"],["Nbat","Nabataean"],["Newa","Newa"],["Nkoo","Nko"],["Nshu","Nushu"],["Ogam","Ogham"],["Olck","Ol_Chiki"],["Onao","Ol_Onal"],["Orkh","Old_Turkic"],["Orya","Oriya"],["Osge","Osage"],["Osma","Osmanya"],["Ougr","Old_Uyghur"],["Palm","Palmyrene"],["Pauc","Pau_Cin_Hau"],["Perm","Old_Permic"],["Phag","Phags_Pa"],["Phli","Inscriptional_Pahlavi"],["Phlp","Psalter_Pahlavi"],["Phnx","Phoenician"],["Plrd","Miao"],["Prti","Inscriptional_Parthian"],["Rjng","Rejang"],["Rohg","Hanifi_Rohingya"],["Runr","Runic"],["Samr","Samaritan"],["Sarb","Old_South_Arabian"],["Saur","Saurashtra"],["Sgnw","SignWriting"],["Shaw","Shavian"],["Shrd","Sharada"],["Sidd","Siddham"],["Sind","Khudawadi"],["Sinh","Sinhala"],["Sogd","Sogdian"],["Sogo","Old_Sogdian"],["Sora","Sora_Sompeng"],["Soyo","Soyombo"],["Sund","Sundanese"],["Sunu","Sunuwar"],["Sylo","Syloti_Nagri"],["Syrc","Syriac"],["Tagb","Tagbanwa"],["Takr","Takri"],["Tale","Tai_Le"],["Talu","New_Tai_Lue"],["Taml","Tamil"],["Tang","Tangut"],["Tavt","Tai_Viet"],["Telu","Telugu"],["Tfng","Tifinagh"],["Tglg","Tagalog"],["Thaa","Thaana"],["Thai","Thai"],["Tibt","Tibetan"],["Tirh","Tirhuta"],["Tnsa","Tangsa"],["Todr","Todhri"],["Toto","Toto"],["Tutg","Tulu_Tigalari"],["Ugar","Ugaritic"],["Vaii","Vai"],["Vith","Vithkuqi"],["Wara","Warang_Citi"],["Wcho","Wancho"],["Xpeo","Old_Persian"],["Xsux","Cuneiform"],["Yezi","Yezidi"],["Yiii","Yi"],["Zanb","Zanabazar_Square"],["Zinh","Inherited"],["Zyyy","Common"],["Zzzz","Unknown"]],"scriptRanges":[[0,64,"Zyyy"],[65,90,"Latn"],[91,96,"Zyyy"],[97,122,"Latn"],[123,169,"Zyyy"],[170,170,"Latn"],[171,185,"Zyyy"],[186,186,"Latn"],[187,191,"Zyyy"],[192,214,"Latn"],[215,215,"Zyyy"],[216,246,"Latn"],[247,247,"Zyyy"],[248,696,"Latn"],[697,735,"Zyyy"],[736,740,"Latn"],[741,745,"Zyyy"],[746,747,"Bopo"],[748,767,"Zyyy"],[768,879,"Zinh"],[880,883,"Grek"],[884,884,"Zyyy"],[885,887,"Grek"],[890,893,"Grek"],[894,894,"Zyyy"],[895,895,"Grek"],[900,900,"Grek"],[901,901,"Zyyy"],[902,902,"Grek"],[903,903,"Zyyy"],[904,906,"Grek"],[908,908,"Grek"],[910,929,"Grek"],[931,993,"Grek"],[994,1007,"Copt"],[1008,1023,"Grek"],[1024,1156,"Cyrl"],[1157,1158,"Zinh"],[1159,1327,"Cyrl"],[1329,1366,"Armn"],[1369,1418,"Armn"],[1421,1423,"Armn"],[1425,1479,"Hebr"],[1488,1514,"Hebr"],[1519,1524,"Hebr"],[1536,1540,"Arab"],[1541,1541,"Zyyy"],[1542,1547,"Arab"],[1548,1548,"Zyyy"],[1549,1562,"Arab"],[1563,1563,"Zyyy"],[1564,1566,"Arab"],[1567,1567,"Zyyy"],[1568,1599,"Arab"],[1600,1600,"Zyyy"],[1601,1610,"Arab"],[1611,1621,"Zinh"],[1622,1647,"Arab"],[1648,1648,"Zinh"],[1649,1756,"Arab"],[1757,1757,"Zyyy"],[1758,1791,"Arab"],[1792,1805,"Syrc"],[1807,1866,"Syrc"],[1869,1871,"Syrc"],[1872,1919,"Arab"],[1920,1969,"Thaa"],[1984,2042,"Nkoo"],[2045,2047,"Nkoo"],[2048,2093,"Samr"],[2096,2110,"Samr"],[2112,2139,"Mand"],[2142,2142,"Mand"],[2144,2154,"Syrc"],[2160,2190,"Arab"],[2192,2193,"Arab"],[2199,2273,"Arab"],[2274,2274,"Zyyy"],[2275,2303,"Arab"],[2304,2384,"Deva"],[2385,2388,"Zinh"],[2389,2403,"Deva"],[2404,2405,"Zyyy"],[2406,2431,"Deva"],[2432,2435,"Beng"],[2437,2444,"Beng"],[2447,2448,"Beng"],[2451,2472,"Beng"],[2474,2480,"Beng"],[2482,2482,"Beng"],[2486,2489,"Beng"],[2492,2500,"Beng"],[2503,2504,"Beng"],[2507,2510,"Beng"],[2519,2519,"Beng"],[2524,2525,"Beng"],[2527,2531,"Beng"],[2534,2558,"Beng"],[2561,2563,"Guru"],[2565,2570,"Guru"],[2575,2576,"Guru"],[2579,2600,"Guru"],[2602,2608,"Guru"],[2610,2611,"Guru"],[2613,2614,"Guru"],[2616,2617,"Guru"],[2620,2620,"Guru"],[2622,2626,"Guru"],[2631,2632,"Guru"],[2635,2637,"Guru"],[2641,2641,"Guru"],[2649,2652,"Guru"],[2654,2654,"Guru"],[2662,2678,"Guru"],[2689,2691,"Gujr"],[2693,2701,"Gujr"],[2703,2705,"Gujr"],[2707,2728,"Gujr"],[2730,2736,"Gujr"],[2738,2739,"Gujr"],[2741,2745,"Gujr"],[2748,2757,"Gujr"],[2759,2761,"Gujr"],[2763,2765,"Gujr"],[2768,2768,"Gujr"],[2784,2787,"Gujr"],[2790,2801,"Gujr"],[2809,2815,"Gujr"],[2817,2819,"Orya"],[2821,2828,"Orya"],[2831,2832,"Orya"],[2835,2856,"Orya"],[2858,2864,"Orya"],[2866,2867,"Orya"],[2869,2873,"Orya"],[2876,2884,"Orya"],[2887,2888,"Orya"],[2891,2893,"Orya"],[2901,2903,"Orya"],[2908,2909,"Orya"],[2911,2915,"Orya"],[2918,2935,"Orya"],[2946,2947,"Taml"],[2949,2954,"Taml"],[2958,2960,"Taml"],[2962,2965,"Taml"],[2969,2970,"Taml"],[2972,2972,"Taml"],[2974,2975,"Taml"],[2979,2980,"Taml"],[2984,2986,"Taml"],[2990,3001,"Taml"],[3006,3010,"Taml"],[3014,3016,"Taml"],[3018,3021,"Taml"],[3024,3024,"Taml"],[3031,3031,"Taml"],[3046,3066,"Taml"],[3072,3084,"Telu"],[3086,3088,"Telu"],[3090,3112,"Telu"],[3114,3129,"Telu"],[3132,3140,"Telu"],[3142,3144,"Telu"],[3146,3149,"Telu"],[3157,3158,"Telu"],[3160,3162,"Telu"],[3165,3165,"Telu"],[3168,3171,"Telu"],[3174,3183,"Telu"],[3191,3199,"Telu"],[3200,3212,"Knda"],[3214,3216,"Knda"],[3218,3240,"Knda"],[3242,3251,"Knda"],[3253,3257,"Knda"],[3260,3268,"Knda"],[3270,3272,"Knda"],[3274,3277,"Knda"],[3285,3286,"Knda"],[3293,3294,"Knda"],[3296,3299,"Knda"],[3302,3311,"Knda"],[3313,3315,"Knda"],[3328,3340,"Mlym"],[3342,3344,"Mlym"],[3346,3396,"Mlym"],[3398,3400,"Mlym"],[3402,3407,"Mlym"],[3412,3427,"Mlym"],[3430,3455,"Mlym"],[3457,3459,"Sinh"],[3461,3478,"Sinh"],[3482,3505,"Sinh"],[3507,3515,"Sinh"],[3517,3517,"Sinh"],[3520,3526,"Sinh"],[3530,3530,"Sinh"],[3535,3540,"Sinh"],[3542,3542,"Sinh"],[3544,3551,"Sinh"],[3558,3567,"Sinh"],[3570,3572,"Sinh"],[3585,3642,"Thai"],[3647,3647,"Zyyy"],[3648,3675,"Thai"],[3713,3714,"Laoo"],[3716,3716,"Laoo"],[3718,3722,"Laoo"],[3724,3747,"Laoo"],[3749,3749,"Laoo"],[3751,3773,"Laoo"],[3776,3780,"Laoo"],[3782,3782,"Laoo"],[3784,3790,"Laoo"],[3792,3801,"Laoo"],[3804,3807,"Laoo"],[3840,3911,"Tibt"],[3913,3948,"Tibt"],[3953,3991,"Tibt"],[3993,4028,"Tibt"],[4030,4044,"Tibt"],[4046,4052,"Tibt"],[4053,4056,"Zyyy"],[4057,4058,"Tibt"],[4096,4255,"Mymr"],[4256,4293,"Geor"],[4295,4295,"Geor"],[4301,4301,"Geor"],[4304,4346,"Geor"],[4347,4347,"Zyyy"],[4348,4351,"Geor"],[4352,4607,"Hang"],[4608,4680,"Ethi"],[4682,4685,"Ethi"],[4688,4694,"Ethi"],[4696,4696,"Ethi"],[4698,4701,"Ethi"],[4704,4744,"Ethi"],[4746,4749,"Ethi"],[4752,4784,"Ethi"],[4786,4789,"Ethi"],[4792,4798,"Ethi"],[4800,4800,"Ethi"],[4802,4805,"Ethi"],[4808,4822,"Ethi"],[4824,4880,"Ethi"],[4882,4885,"Ethi"],[4888,4954,"Ethi"],[4957,4988,"Ethi"],[4992,5017,"Ethi"],[5024,5109,"Cher"],[5112,5117,"Cher"],[5120,5759,"Cans"],[5760,5788,"Ogam"],[5792,5866,"Runr"],[5867,5869,"Zyyy"],[5870,5880,"Runr"],[5888,5909,"Tglg"],[5919,5919,"Tglg"],[5920,5940,"Hano"],[5941,5942,"Zyyy"],[5952,5971,"Buhd"],[5984,5996,"Tagb"],[5998,6000,"Tagb"],[6002,6003,"Tagb"],[6016,6109,"Khmr"],[6112,6121,"Khmr"],[6128,6137,"Khmr"],[6144,6145,"Mong"],[6146,6147,"Zyyy"],[6148,6148,"Mong"],[6149,6149,"Zyyy"],[6150,6169,"Mong"],[6176,6264,"Mong"],[6272,6314,"Mong"],[6320,6389,"Cans"],[6400,6430,"Limb"],[6432,6443,"Limb"],[6448,6459,"Limb"],[6464,6464,"Limb"],[6468,6479,"Limb"],[6480,6509,"Tale"],[6512,6516,"Tale"],[6528,6571,"Talu"],[6576,6601,"Talu"],[6608,6618,"Talu"],[6622,6623,"Talu"],[6624,6655,"Khmr"],[6656,6683,"Bugi"],[6686,6687,"Bugi"],[6688,6750,"Lana"],[6752,6780,"Lana"],[6783,6793,"Lana"],[6800,6809,"Lana"],[6816,6829,"Lana"],[6832,6862,"Zinh"],[6912,6988,"Bali"],[6990,7039,"Bali"],[7040,7103,"Sund"],[7104,7155,"Batk"],[7164,7167,"Batk"],[7168,7223,"Lepc"],[7227,7241,"Lepc"],[7245,7247,"Lepc"],[7248,7295,"Olck"],[7296,7306,"Cyrl"],[7312,7354,"Geor"],[7357,7359,"Geor"],[7360,7367,"Sund"],[7376,7378,"Zinh"],[7379,7379,"Zyyy"],[7380,7392,"Zinh"],[7393,7393,"Zyyy"],[7394,7400,"Zinh"],[7401,7404,"Zy